{
  "schema_version": "1.0.0",
  "id": "3b2f5c4e-9d8b-4b6b-8f3e-1c2f4e6b7a9d",
  "title": "Comprehensive Room Types Catalog for Egyptian Hotels",
  "version": "1.0.0",
  "language": "en",
  "country": "EG",
  "industry": "hotels",
  "department": "sales",
  "tags": [
    "hotels",
    "sales",
    "room-types-catalog",
    "guest-experience",
    "revenue-optimization"
  ],
  "priority": "high",
  "owner": "operations@organization.com",
  "last_updated": "2023-10-25T12:00:00Z",
  "offer_type": "service",
  "service_ref": "room-catalog-service-eg",
  "pricing": {
    "model": "per-unit",
    "currency": "EGP",
    "base_price": 500,
    "unit": "room night",
    "billing_cycle": "one-time"
  },
  "validity": {
    "start_date": "2023-11-01",
    "end_date": "2024-12-31",
    "limited_quantity": 100
  },
  "description": "This document outlines the comprehensive catalog of room types available in Egyptian hotels, focusing on optimizing guest experience and revenue. The catalog includes detailed descriptions of each room type, amenities, and service offerings tailored to meet diverse guest needs. The pricing model is designed to maximize RevPAR and ADR through strategic channel mix management and dynamic pricing strategies. This offer is valid for a limited number of room nights and is subject to availability.",
  "status": "draft",
  "effective_date": "2023-11-01",
  "expiry_date": "2024-12-31",
  "review_date": "2024-06-01",
  "created_by": "operations@organization.com",
  "approved_by": "sales-director@organization.com",
  "source_url": "https://www.organization.com/room-types-catalog",
  "attachments": [
    {
      "name": "Room_Types_Catalog.pdf",
      "path": "/documents/Room_Types_Catalog.pdf",
      "mime_type": "application/pdf",
      "size_bytes": 204800,
      "checksum": "sha256:3d2e1f0b9a8c4d6e7f8a9b0c1d2e3f4a5b6c7d8e9f0a1b2c3d4e5f6a7b8c9d0e"
    }
  ],
  "external_id": "EG-RTC-2023",
  "locale_overrides": {},
  "eligibility_rules": [
    "Must be booked through official hotel channels",
    "Subject to availability at the time of booking"
  ],
  "exclusions": [
    "Not applicable with other promotions",
    "Excludes blackout dates"
  ],
  "discount": {
    "type": "percentage",
    "value": 10
  },
  "checksum": "sha256:64768b5b37d8025232470487b0ebb7e203b84dacff1e84f57cfcedf5b5c1b355"
}